{
  "generated_at": "2026-09-25T17:04:49Z",
  "generated_by": "build_ground_truth.py",
  "pinned_versions": {
    "standards": "syn65676531.99",
    "datasets": "syn68258237.15",
    "organizations": "syn69693360.32",
    "topics": "syn75081383.8",
    "substrates": "syn63096834.32",
    "manifest": "syn72106735.21",
    "d4d": "syn68885644.13"
  },
  "category_counts": {
    "keyword-lookup": 6,
    "categorical-filter": 6,
    "multi-filter-and": 4,
    "multi-filter-or": 2,
    "redirect": 8,
    "linked-resource": 7,
    "d4d": 5,
    "counts": 4
  },
  "items": [
    {
      "id": "rs-keyword-fhir",
      "category": "keyword-lookup",
      "question": "What standard uses the acronym FHIR?",
      "persona": "RESEARCHER",
      "notes": "Exact-match acronym lookup; 'FHIR' resolves to exactly one standards row at the pinned version, confirmed live.",
      "expected_tool_calls": [
        {
          "function": "sqlQuery",
          "constraints": {
            "table": "standards",
            "required_columns": [
              "acronym"
            ],
            "required_values": [
              "FHIR"
            ]
          }
        },
        {
          "function": "buildPortalUrl",
          "required": false,
          "constraints": {
            "resourceType": "standards",
            "id": "B2AI_STANDARD:109"
          }
        }
      ],
      "expected_answer": {
        "id": "B2AI_STANDARD:109",
        "acronym": "FHIR",
        "name": "Fast Healthcare Interoperability Resources",
        "category": "Biomedical Standard",
        "detail_url": "https://b2ai.standards.synapse.org/Explore/Standard/DetailsPage?id=B2AI_STANDARD:109"
      },
      "ground_truth_query": "SELECT id, acronym, name, category FROM {standards} WHERE \"acronym\" = 'FHIR'",
      "llm_judge_fallback": false
    },
    {
      "id": "rs-keyword-dicom",
      "category": "keyword-lookup",
      "question": "What is the DICOM standard?",
      "persona": "RESEARCHER",
      "notes": "Exact-match acronym lookup; 'DICOM' resolves to exactly one standards row at the pinned version, confirmed live.",
      "expected_tool_calls": [
        {
          "function": "sqlQuery",
          "constraints": {
            "table": "standards",
            "required_columns": [
              "acronym"
            ],
            "required_values": [
              "DICOM"
            ]
          }
        },
        {
          "function": "buildPortalUrl",
          "required": false,
          "constraints": {
            "resourceType": "standards",
            "id": "B2AI_STANDARD:98"
          }
        }
      ],
      "expected_answer": {
        "id": "B2AI_STANDARD:98",
        "acronym": "DICOM",
        "name": "Digital Imaging And Communications In Medicine",
        "category": "Biomedical Standard",
        "detail_url": "https://b2ai.standards.synapse.org/Explore/Standard/DetailsPage?id=B2AI_STANDARD:98"
      },
      "ground_truth_query": "SELECT id, acronym, name, category FROM {standards} WHERE \"acronym\" = 'DICOM'",
      "llm_judge_fallback": false
    },
    {
      "id": "rs-keyword-redcap",
      "category": "keyword-lookup",
      "question": "Tell me about the REDCap tool.",
      "persona": "RESEARCHER",
      "notes": "Exact-match acronym lookup; 'REDCap' resolves to exactly one standards row at the pinned version, confirmed live.",
      "expected_tool_calls": [
        {
          "function": "sqlQuery",
          "constraints": {
            "table": "standards",
            "required_columns": [
              "acronym"
            ],
            "required_values": [
              "REDCap"
            ]
          }
        },
        {
          "function": "buildPortalUrl",
          "required": false,
          "constraints": {
            "resourceType": "standards",
            "id": "B2AI_STANDARD:821"
          }
        }
      ],
      "expected_answer": {
        "id": "B2AI_STANDARD:821",
        "acronym": "REDCap",
        "name": "Research Electronic Data Capture",
        "category": "Software or Tool",
        "detail_url": "https://b2ai.standards.synapse.org/Explore/Standard/DetailsPage?id=B2AI_STANDARD:821"
      },
      "ground_truth_query": "SELECT id, acronym, name, category FROM {standards} WHERE \"acronym\" = 'REDCap'",
      "llm_judge_fallback": false
    },
    {
      "id": "rs-keyword-ncit",
      "category": "keyword-lookup",
      "question": "What is NCIT?",
      "persona": "RESEARCHER",
      "notes": "Exact-match acronym lookup; 'NCIT' resolves to exactly one standards row at the pinned version, confirmed live.",
      "expected_tool_calls": [
        {
          "function": "sqlQuery",
          "constraints": {
            "table": "standards",
            "required_columns": [
              "acronym"
            ],
            "required_values": [
              "NCIT"
            ]
          }
        },
        {
          "function": "buildPortalUrl",
          "required": false,
          "constraints": {
            "resourceType": "standards",
            "id": "B2AI_STANDARD:501"
          }
        }
      ],
      "expected_answer": {
        "id": "B2AI_STANDARD:501",
        "acronym": "NCIT",
        "name": "NCI Thesaurus OBO Edition",
        "category": "Ontology or Vocabulary",
        "detail_url": "https://b2ai.standards.synapse.org/Explore/Standard/DetailsPage?id=B2AI_STANDARD:501"
      },
      "ground_truth_query": "SELECT id, acronym, name, category FROM {standards} WHERE \"acronym\" = 'NCIT'",
      "llm_judge_fallback": false
    },
    {
      "id": "rs-keyword-loinc",
      "category": "keyword-lookup",
      "question": "Look up the LOINC standard.",
      "persona": "RESEARCHER",
      "notes": "Exact-match acronym lookup; 'LOINC' resolves to exactly one standards row at the pinned version, confirmed live.",
      "expected_tool_calls": [
        {
          "function": "sqlQuery",
          "constraints": {
            "table": "standards",
            "required_columns": [
              "acronym"
            ],
            "required_values": [
              "LOINC"
            ]
          }
        },
        {
          "function": "buildPortalUrl",
          "required": false,
          "constraints": {
            "resourceType": "standards",
            "id": "B2AI_STANDARD:187"
          }
        }
      ],
      "expected_answer": {
        "id": "B2AI_STANDARD:187",
        "acronym": "LOINC",
        "name": "Logical Observation Identifier Names and Codes",
        "category": "Ontology or Vocabulary",
        "detail_url": "https://b2ai.standards.synapse.org/Explore/Standard/DetailsPage?id=B2AI_STANDARD:187"
      },
      "ground_truth_query": "SELECT id, acronym, name, category FROM {standards} WHERE \"acronym\" = 'LOINC'",
      "llm_judge_fallback": false
    },
    {
      "id": "rs-keyword-snomed",
      "category": "keyword-lookup",
      "question": "What is SNOMED CT used for?",
      "persona": "RESEARCHER",
      "notes": "Exact-match acronym lookup; 'SNOMED CT' resolves to exactly one standards row at the pinned version, confirmed live.",
      "expected_tool_calls": [
        {
          "function": "sqlQuery",
          "constraints": {
            "table": "standards",
            "required_columns": [
              "acronym"
            ],
            "required_values": [
              "SNOMED CT"
            ]
          }
        },
        {
          "function": "buildPortalUrl",
          "required": false,
          "constraints": {
            "resourceType": "standards",
            "id": "B2AI_STANDARD:553"
          }
        }
      ],
      "expected_answer": {
        "id": "B2AI_STANDARD:553",
        "acronym": "SNOMED CT",
        "name": "Systematized Nomenclature of Medicine - Clinical Terms",
        "category": "Ontology or Vocabulary",
        "detail_url": "https://b2ai.standards.synapse.org/Explore/Standard/DetailsPage?id=B2AI_STANDARD:553"
      },
      "ground_truth_query": "SELECT id, acronym, name, category FROM {standards} WHERE \"acronym\" = 'SNOMED CT'",
      "llm_judge_fallback": false
    },
    {
      "id": "rs-cat-ontology-vocab",
      "category": "categorical-filter",
      "question": "How many ontologies or vocabularies are in the catalog?",
      "persona": "RESEARCHER",
      "notes": "'category' is a fixed enum; 'Ontology or Vocabulary' is one exact value.",
      "expected_tool_calls": [
        {
          "function": "sqlQuery",
          "constraints": {
            "table": "standards",
            "required_columns": [
              "category"
            ],
            "required_values": [
              "Ontology or Vocabulary"
            ],
            "forbid_values": [
              "true",
              "false",
              "True",
              "False"
            ]
          }
        }
      ],
      "expected_answer": {
        "column": "category",
        "value": "Ontology or Vocabulary",
        "count": 179,
        "sample_id": "B2AI_STANDARD:74",
        "sample_name": "Current Procedural Terminology"
      },
      "ground_truth_query": "SELECT COUNT(*) FROM {standards} WHERE \"category\" = 'Ontology or Vocabulary'",
      "llm_judge_fallback": false
    },
    {
      "id": "rs-cat-used-in-b2ai",
      "category": "categorical-filter",
      "question": "Which standards are actually used in Bridge2AI?",
      "persona": "RESEARCHER",
      "notes": "`usedInBridge2AI` is a STRING flag ('Yes'/'No'), not a boolean \u2014 the exact bug class fixed in review (plans/retarget-b2ai-standards-explorer.md phase 1). A query comparing to `true` would return 0 rows against the real column.",
      "expected_tool_calls": [
        {
          "function": "sqlQuery",
          "constraints": {
            "table": "standards",
            "required_columns": [
              "usedInBridge2AI"
            ],
            "required_values": [